{
  "description": "A password in a URL is redacted; the user, host and port are kept",
  "kind": "text",
  "input": "Could not connect to mysql://chapel:hunter2@127.0.0.1:3306/chapelcore or redis://:s3cret@localhost:6379; https://api.example.org/ has none",
  "expected": "Could not connect to mysql://chapel:[redacted]@127.0.0.1:3306/chapelcore or redis://:[redacted]@localhost:6379; https://api.example.org/ has none"
}
